{
  "profile": {
    "name": "Nilesh Laxmi",
    "role": "Frontend Tech Lead / Cross-Platform UI Lead",
    "location": "Delhi, India",
    "phone": "+91 • hidden",
    "email": {
      "label": "nileshlaxmi4@gmail.com",
      "href": "mailto:nileshlaxmi4@gmail.com"
    },
    "avatar": "NL",
    "links": [
      {
        "label": "LinkedIn",
        "href": "https://www.linkedin.com/in/nilesh-laxmi"
      },
      {
        "label": "Portfolio",
        "href": "https://nileshlaxmi.github.io"
      },
      {
        "label": "Github",
        "href": "https://github.com/nileshlaxmi"
      }
    ],
    "resume": {
      "label": "Download resume",
      "href": "/docs/resume.pdf",
      "download": "Nilesh-Laxmi-Resume.pdf"
    }
  },
  "summary": {
    "title": "Summary",
    "description": "Frontend Tech Lead / Cross-Platform UI Lead with 10+ years of experience building scalable, high-traffic, and accessible digital platforms serving millions of users. Specialized in React, React Native Web, modern JavaScript, and platform modernization across web and app ecosystems. Proven track record in driving large-scale migrations, BFF integrations, performance optimization, WCAG accessibility adoption, and business-critical customer journeys with measurable impact on revenue, conversion, and operational efficiency.",
    "stats": [
      { "value": "10+", "label": "Years" },
      { "value": "10+", "label": "Products" }
    ]
  },
  "projects": {
    "title": "Selected Projects",
    "description": "Platform modernization, scalable frontend architecture, accessibility, and customer experience engineering across Airtel Web & Thanks App ecosystems.",
    "items": [
      {
        "title": "Platform Modernization & API Migration",
        "description": "Led modernization of legacy web journeys and backend integrations across airtel.in by driving phased migration toward platform-aligned frontend architecture and BFF-based APIs. Focused on scalability, operational reliability, observability, and long-term maintainability across high-traffic customer journeys."
      },
      {
        "title": "International Roaming Experience",
        "description": "Redesigned international roaming purchase and activation flows with emphasis on guided user experiences, contextual error handling, device capability validation, and resilient order management. Improved journey clarity and reduced friction across complex roaming scenarios."
      },
      {
        "title": "Plan Change & Upgrade Journeys",
        "description": "Built cross-platform upgrade and plan-management experiences for Postpaid and Wi-Fi customers with focus on discoverability, pricing transparency, conversion optimization, and reusable UI architecture across web and app platforms."
      },
      {
        "title": "Recharge & Billing Experiences",
        "description": "Developed modern recharge, billing, and transaction management journeys using reusable frontend systems aligned with Airtel’s evolving design language. Focused on accessibility, performance optimization, and seamless customer interactions across multiple services."
      },
      {
        "title": "Customer Support & Request Tracking Platform",
        "description": "Delivered unified tracking and support experiences integrating orders, complaints, appointments, and service requests across Airtel digital platforms. Improved transparency, operational efficiency, and customer self-service capabilities."
      },
      {
        "title": "Accessibility & Cross-Platform UI Foundation",
        "description": "Championed accessibility-first engineering practices and reusable UI foundations across large-scale customer journeys. Collaborated with product, design, and QA teams to standardize WCAG-compliant experiences and scalable cross-platform frontend patterns."
      }
    ]
  },
  "experience": {
    "title": "Experience",
    "jobs": [
      {
        "company": "Airtel Digital",
        "designation": "Lead Engineer (Frontend)",
        "location": "Gurugram",
        "timeline": "Jan 2022 – Present",
        "techStack": "React, React Native Web, Groovy, Accessibility (WCAG/A11y)",
        "highlights": [
          "Legacy BE API Migration & Platform Modernization: Led migration and deprecation of legacy backend APIs across six airtel.in repositories. Reduced web-consumer traffic from ~20 lakh daily hits to ~45K through phased migration of old web journeys to modern platform stacks, BFF API adoption, and redirect-based gradual deprecation strategy.",
          "Manage Account Journey (airtel.in): Migrated legacy Manage Account journey to the new platform stack supporting all 8 services (earlier only 5 supported). Handles 25K daily unique visits. Built analytics dashboards, monitoring documentation, and operational alert systems using Telegram integrations.",
          "Billing Journey Migration: Migrated legacy Angular billing journey to the new airtel.in platform stack enabling users to check, pay, and download bills for all postpaid services. 4K daily unique visits. Created monitoring dashboards, analytics tracking, documentation, and alerting systems.",
          "Transaction History Journey: Migrated legacy Angular transaction history journey to the modern platform stack enabling users to view and download transaction history across all supported services. Handles 3K daily unique visits. Created dashboards, monitoring documentation, and operational alert systems.",
          "Guided Web → App Journey Migration: Led migration of legacy web-based journeys toward app-first experiences including DTH campaign journeys and DTH account update flows to improve engagement and platform consistency.",
          "BFF API Migrations: Migrated legacy backend APIs to new BFF APIs for DTH Recharge, DTH Box Upgrade, Postpaid Bill Payment, and Wifi Bill Payment journeys. Reduced legacy API traffic to zero across multiple high-volume journeys handling weekly traffic in lakhs. Created Kibana dashboards and operational documentation for health monitoring.",
          "International Roaming (IR) Journey: Developed and enhanced multiple high-traffic IR features including Device Capability checks (10K daily visits), Submit Order flows (7K daily clicks), Back Button optimization (8K daily clicks), and Duplicate Order issue fixes. Improved transparency and customer confidence through contextual error handling and guided remediation steps.",
          "DTH Cartoon Network Campaign: Worked on a successful DTH promotional launch resulting in 52K channel subscriptions.",
          "Security & SWAT Ownership: Resolved 13 security issues across web platforms within one year and handled ~80 SWAT production issues across Thanks App and Web platforms.",
          "Accessibility Leadership: Championed end-to-end accessibility (WCAG 2.1/a11y) compliance across major customer journeys including Selfcare Account, DTH Recharge, Login, Appointments, Recharges, Digital Store, and Track Requests. Collaborated closely with product, design, and QA teams to embed accessibility into the development lifecycle and received accessibility certification.",
          "TRAI Compliance (DND Journey): Led frontend implementation for TRAI-mandated spam and fraud control features. Improved visibility and usability of DND controls across Thanks App and enhanced complaint/reporting flows for spam calls and messages.",
          "TRAI Compliance (Inactive Account Forms): Delivered compliant frontend experiences for inactive Postpaid and Wi-Fi account forms aligned with updated TRAI regulations.",
          "Wi-Fi Change Plan Journey: Designed and implemented a seamless plan upgrade flow on Thanks App including comparison, selection, review, and confirmation experiences. Journey handles 40K daily unique visitors with a 6.5% conversion rate.",
          "Corporate Business Journey (Thanks App & Airtel.in): Delivered onboarding and account management journeys for enterprise customers through email validation and app integrations, reducing offline dependency and operational leakage.",
          "Postpaid Change Plan Journey (2022–2025): Revamped plan discovery UX with comparison tools, upsell nudges, downgrade friction handling, and billing transparency improvements. Delivered 19% conversion uplift and ₹40 Cr annual incremental revenue.",
          "Appointment Journey: Built appointment support journey for Wi-Fi acquisition flow with ~500 daily unique visits.",
          "Track Request Journey (Thanks App & Airtel.in): Enabled unified order and complaint tracking across platforms with appointment handling, communication transparency, and real-time status visibility. Reduced 100K+ assisted calls annually while serving 7K daily unique visits.",
          "Wi-Fi Journey API Migration: Migrated legacy APIs on Thanks App to modern backend architecture improving scalability and maintainability.",
          "Prepaid Recharge Experience (Web): Delivered a redesigned prepaid recharge experience on airtel.in using reusable, brand-aligned UI components consistent with Thanks App design systems. Handles ~2 lakh daily unique visits.",
          "Collaborated across product, backend, analytics, QA, and operations teams to deliver scalable customer journeys, operational monitoring, platform modernization, and high-performance frontend experiences for millions of Airtel users."
        ]
      },
      {
        "company": "TELUS International",
        "designation": "Module Lead",
        "location": "Noida",
        "timeline": "Aug 2018 – Jan 2022",
        "highlights": [
          "Developed Visual IVR systems, chatbot frameworks, and image-capture utilities for enterprise platforms.",
          "Led UI engineering for multiple chatbot platforms including HR Bot, Recruitment Bot, and SPOC Bot with SSO integrations, admin portals, and analytics dashboards.",